{
  "front": "What is flash chromatography in peptide purification?",
  "back": "Flash chromatography is a rapid gravity- or pressure-driven purification using silica gel. It is used for purifying peptide intermediates and small molecules, but is less common for final peptide products.",
  "tags": [
    "purification",
    "chromatography"
  ],
  "difficulty": "beginner"
}