{
  "front": "What is biotinylation?",
  "back": "Biotinylation attaches biotin to lysine residues or the N-terminus. The biotin-streptavidin interaction is used for protein purification, detection, and immunoassays.",
  "tags": [
    "modifications",
    "chemistry"
  ],
  "difficulty": "beginner"
}