{
  "front": "Explain the role of peptide bonds in spider silk mechanical properties.",
  "back": "Spider silk beta-sheet crystallites have tightly packed hydrogen bonds between peptide backbones. The amorphous regions provide extensibility. The combination of crystalline and amorphous regions gives silk its exceptional tensile strength and elasticity.",
  "tags": [
    "peptide-bonds",
    "materials-science",
    "biomaterials"
  ],
  "difficulty": "advanced"
}
