{
  "front": "What is a polypeptide?",
  "back": "A polypeptide is a chain of many amino acids (typically >10) joined by peptide bonds. The terms polypeptide and protein are often used interchangeably for longer chains.",
  "tags": [
    "nomenclature",
    "terminology"
  ],
  "difficulty": "beginner"
}