{
  "front": "What is the role of angiotensin II in hypertension?",
  "back": "Angiotensin II is an octapeptide produced from angiotensin I by ACE. It causes vasoconstriction, aldosterone secretion, sodium retention, and sympathetic activation. Excess angiotensin II is a key driver of essential hypertension and heart failure.",
  "tags": ["disease", "cardiovascular", "hypertension", "raas"],
  "difficulty": "intermediate"
}
