{
  "front": "What is the enthalpy-entropy compensation?",
  "back": "Enthalpy-entropy compensation is a phenomenon where favorable enthalpy changes (e.g., from binding) are partially offset by unfavorable entropy changes (e.g., from conformational restriction).",
  "tags": [
    "interactions",
    "binding"
  ],
  "difficulty": "advanced"
}