{
  "front": "How does the peptide bond dipole moment affect protein structure?",
  "back": "The peptide bond has a dipole moment of approximately 3.5 D, with the oxygen partially negative and the nitrogen partially positive. In alpha-helices, these dipoles align, creating a macroscopic helix dipole.",
  "tags": [
    "peptide-bonds",
    "structure"
  ],
  "difficulty": "advanced"
}