{
  "front": "What is Oxyma Pure and how does it compare to HOBt?",
  "back": "Oxyma Pure is a racemization suppressant and coupling additive. It has similar efficiency to HOBt but is non-explosive, making it a safer alternative for large-scale peptide synthesis.",
  "tags": [
    "synthesis",
    "reagents"
  ],
  "difficulty": "intermediate"
}